순위,제목,저자,출판사,요약
86,AutoCAD 실무 무작정 따라하기 CD1장포함 ,양승규,길벗,"[AutoCAD 실무 무작정 따라하기 AutoCAD 2013-2017범용 ]는 실무 건축사이자 오토캐드 인증 시험 감독관, 오토데스크 코리아의 오토캐드 파워유저로 활동 중인 저자의 실무 경험을 바탕으로 현장에서 바로 쓸 수"
87,CAT CAD실무능력평가 2급 따라하면 합격이다! ,김주화,엠듀,"합격률을 높이기 위해 만든 한국생산성본부 공식 인증 교재! 
책은 CAD실무능력평가 CAT  2급 시험 합격에 꼭 필요한 노하우들을 자세히 기술하였다.   

이 책은 교육시장에서 요구하는 AutoCAD의"
88,CATIA V5 기초와 활용 2판 ,민상기,복두출판사,▶이 책은 CATIA V5 기초와 활용을 다룬 이론서입니다. CATIA V5 기초와 활용의 기초적이고 전반적인 내용을 학습할 수 있도록 구성했습니다.
89,재영아빠와 함께하는 Creo 4.0 상  CD1장포함 ,허환호,비엔이,저자는 고객 지원과 다양한 CAD를 사용해 본 경험을 살려 이 책을 집필했다. 그가 이전에 집필한 책들과는 달리 20개의 도면과 동영상을 포함하여 초보자도 더욱 쉽게 명령을 익힐 수 있다.
90,재영아빠와 함께하는 Creo 4.0 하  CD1장포함 ,허환호,비엔이,저자는 고객 지원과 다양한 CAD를 사용해 본 경험을 살려 이 책을 집필했다. 그가 이전에 집필한 책들과는 달리 20개의 도면과 동영상을 포함하여 초보자도 더욱 쉽게 명령을 익힐 수 있다.
