순위,제목,저자,출판사,요약
1,Clean Code 클린 코드 ,로버트 C. 마틴,인사이트,『Clean Code 클린 코드 』은 오브젝트 멘토 Object Mentor 의 동료들과 힘을 모아 ‘개발하며’ 클린 코드를 만드는 최상의 애자일 기법을 소개하고 있다. 소프트웨어 장인 정신의 가치를 심어 주며 프로그래밍
2,개발자의 글쓰기,김철수,위키북스,"이 책은 개발자의 글쓰기 능력을 종합적으로 향상하기 위한 책이다. 코드 안에서는 함수와 변수 이름을 짓는 것부터 주석 쓰는 법, 에러 메시지 쓰는 법까지 알려준다. 코드 밖에서는 릴리스 노트, 장애 보고서,"
3,린 스타트업,에릭 리스,인사이트,"지속적 혁신을 실현하는 창업의 과학『린 스타트업』. 불확실한 창업 환경에서 지속적 혁신을 실현할 수 있는 창업 방법은 무엇일까? 이 책은 이러한 질문의 대안으로, 최근 실리콘밸리를 중심으로 주목을 받고"
4,커리어 스킬,존 손메즈,길벗,"전 세계 많은 사람이 같은 고민을 하고, 같은 질문을 던졌다. 이에 대한 대답을 모은 이 책은 출간 즉시 아마존 베스트셀러에 올랐다. 왜 수많은 사람이 이 책을 반복해서 읽고, 별점 5점을 주고, 주변 사람들에게"
5,그림으로 배우는 클라우드,하야시 미사유키,영진닷컴,"클라우드 컴퓨팅은 현재 비즈니스와 일상생활에서 빼놓을 수 없는 존재가 되었다. 애플리케이션 개발, 웹 서비스 등을 넘어서 최근에는 기업용 정보 시스템과 IoT Internet of Things  플랫폼 등으로 이용 범위가"
6,디지털 마케팅과 페이스북 광고,이민규,디지털북스,"마케팅의 다변화가 이루어지는 시대, 트랜디하고 효과적인 마케팅으로 높은 성과를 이뤄낸 이민규 마케터의 실전경험을 이 책 한권에 담았다. 마케팅 베테랑인 그가 어떠한 방식으로 디지털 마케팅에 접근하는지,"
7,테스트 주도 개발 프로그램 프로그래밍 프로그래머 4 ,켄트 벡,인사이트,"테스트 주도 개발은 테스트가 개발을 주도하는 방법이다. 테스트가 개발을 주도한다는 것은 테스트가 코딩의 방향을 이끌어 간다는 말이다. 테스트를 실패하는 코드가 없으면 코딩을 하지 않고, 코드상에 중복이"
8,실용주의 프로그래머,앤드류 헌트,인사이트,"[실용주의 프로그래머]는 초보를 벗어나고자 하는 프로그래머를 위해 저자들의 오랜 성찰을 통해 정제한 지혜와 구체적인 실천법으로 안내한다. 코딩 가이드라인, 설계에 대한 격언, 프로젝트 관리에 대한 조언,"
9,그로스 해킹 Growth Hacking ,라이언 홀리데이,길벗,‘그로스 해킹’이라는 단어가 생소한가? 그렇다하더라도 이메일의 끝에 “아이폰에서 보낸 메시지입니다”라는 문구를 본 이들은 많을 것이다. 이 한 줄의 문구는 이메일을 받는 이들에게 아이폰을 홍보하는
10,개발자도 궁금한 IT 인프라,정송화,제이펍,"최강 조합의 IT 인프라 만담가 3인이 뭉쳤다!

이 책은 IT 인프라 기술에 관심이 있거나 입문하려는 분들에게 필요한 기술과 현장의 생생한 이야기 등 꼭 알려주고 싶은 이야기를 담았습니다. IT 인프라의 기초"
11,창업의 과학,다도코로 마사유키,한빛미디어,"스타트업이 겪는 문제에는 반드시 이유가 있다!
창업을 시작해 성공에 이르는 필수 과정을 스무 단계로 소개한다. 당신의 스타트업이 지금 문제를 겪고 있다면 어떤 단계를 생략했거나 무시하고 지나갔을"
12,피플웨어 3판 ,톰 드마르코,인사이트,『피플웨어』는 소프트웨어의 주요 쟁점을 기술이 아닌 사람에 있다고 이야기하는 책이다. 소프트웨어 개발을 사회적이고 인간적으로 풀어나가는 것이 인간적이고 생산적인 작업 환경을 만드는 방법이라고
13,컴퓨터과학이 여는 세계,이광근,인사이트,"『컴퓨터과학이 여는 세계』는 정보이론, 암호, 개인인증 등 컴퓨터과학이 보여주는 풍경 아래 흐르는, 원천 아이디어가 나온 이야기와 의미를 들려준다. 원천지식의 동기와 근본을 꿰뚫는 시각을 튼튼히 한다면"
14,미래의 핵심 기술,Mitsumura Naoki,정보문화사,"AI, IoT, 가상 통화 등 다양한 혁신적인 기술이 등장했습니다. 하지만 이것들은 그 배경에 있는 핵심 기술을 응용한 예일 뿐입니다. 그래서 여기서는 앞으로의 사회에 결정적인 영향을 미칠 5개의 가장 중요한"
15,이펙티브 프로그래밍 코딩 호러의  위키북스 IT Leaders 시리즈 16 ,제프 앳우드,위키북스,프로그래밍』. ‘코딩 호러’와 ‘스택 오버플로우’ 두 사이트를 탄생시킨 저자의 소프트웨어 개발과 관련된 지혜와 조언이 가감 없이 담겨 있다. 그동안 코딩 호러에 실린 글 중에서 엄선한 글만 실린 이 책은
16,클라우드 도입 실천 전략,모어 압둘라,에이콘출판,"IBM 클라우드 개러지 팀의 방법과 노하우를 통해 클라우드 도입 전략을 알아보는 책이다. 애자일 개발과 데브옵스, 린 스타트업 등 업계의 모범 사례를 통합해 기업이 클라우드를 도입하고 애플리케이션 설계,"
17,된다! 일당백 마케터의 업무 자동화,박주훈,이지스퍼블리싱,"지메일 자동 답변부터 SNS 일괄 업로드까지!
오늘 당장 업무가 빨라지는 온라인 마케팅 입문서

이 책은 현직 마케터가 썼다. 마케팅 현장의 고충을 누구보다도 잘 알기에 뜬구름 잡는 이론이 아닌 당장"
18,최신 IT 트렌드 그림 한 장으로 보는  개정증보판 ,Saito Masanori,정보문화사,대부분 사람들이 IT가 중요하다는 것은 알지만 실제로 실생활과 비즈니스에 끼치는 IT의 영향력에 대해서는 무감각한 경우가 많다. IoT와 인공지능은 빠른 시간 내 놀랄 정도로 발전하여 실용화도 급속히 진행되고
19,생각하는 프로그래밍 프로그램 프로그래밍 프로그래머 ,존 벤틀리,인사이트,"프로그래밍 본질에 관한 15가지 에세이 『생각하는 프로그래밍』. ACM의 전통 있는 간행물 CACM에 연재된 《Programming Pearls》의 칼럼을 엮은 것으로, 몇 개의 간단한 알고리즘 및 데이터 구조를 통해 문제를"
20,페이스북 마케팅 백만 방문자와 소통하는  2판 ,종유진,한빛미디어,"이 책은 1인 미디어 시대에 제품 판매나 브랜드 구축을 위해 필요한 페이스북, 그중에서도 페이스북 페이지와 광고 최적화를 위한 거의 모든 기능을 담고 있다. 지난 5년 동안 필자들이 페이스북에서 친구 관계를"
21,MANAGE IT 매니지 잇  위키북스 IT LEADERS 시리즈 10 ,요한나 로스먼,위키북스,"최신 기법으로 배우는 실용주의 프로젝트 관리『Manage it! 매니지 잇 』. 이 책은 프로젝트의 맥락을 충분하게 살피고, 프로젝트를 성공으로 이끄는 관리방법을 선택해서 적용하는 방법을 담고 있다. 프로젝트"
22,4차 산업혁명을 이끌 IT 과학이야기 누구나 읽을 수 있는 IT 과학이야기 2 ,이재영,로드북,"4차 산업혁명이 화두입니다. 인공지능에 직업을 빼앗길지도 모른다는 공포가 있습니다. 운전자 없는 자동차의 신세계가 다가오고 있습니다. 로봇은 이미 생활 속 깊숙이 들어와 있습니다. 자, 우리는 무엇을"
23,클라우드 컴퓨팅 재출간판 ,토마스 얼,에이콘출판,"2015년 대한민국학술원 우수 학술도서 선정도서
클라우드 컴퓨팅의 개념부터 모델, 기술 아키텍처에 이르기까지 클라우드 컴퓨팅의 모든 것을 명확하게 정의하고 있으며, 다양한 응용사례를 다루는 책이다."
24,소프트 스킬,존 손메즈,길벗,"저자 존 손메즈가 이 책을 쓴 이유는 개발자로 사는 데 도움이 되는 정보와 조언을 집약적으로 담은 안내서를 만들고 싶어서다. 자신이 33세에 은퇴하기까지 성공과 실패를 통해 배운 것, 여러 사람을 만나면서"
25,전자정부 표준프레임워크 퀵스타트,채규태,루비페이퍼,"전자정부 표준프레임워크 완벽 해설
이 책의 전반부에는 표준프레임워크의 개발 환경에 대해 다룬다. 기본적인 환경 구축을 시작으로 Eclipse 플러그인을 업데이트하는 방법, 추가적인 오픈 소스나 라이브러리를"
26,왜 시스템 개발만 하면 싸워댈까? IT Leaders 21 ,호소카와 요시히로,위키북스,[왜 시스템 개발만 하면 싸워댈까?]는 여러 IT 분쟁 사례를 비롯해 저자가 IT 기술자였던 시절과 컨설턴트 시절에 겪은 경험을 바탕으로 프로젝트의 실패 원인을 분석하고 해결책을 고민해 정리한 책이다. 이 책은
27,"스마트 시대, 바르고 건강하게 살기 BARUN ICT Life Series 1 ",김범수,이담북스,"지난 몇 년 사이, 우리 사회에서 화두로 떠오른 ‘4차 산업혁명’은 거부할 수 없는 시대의 흐름이 되었다. 사회 체계 전반이 혁명적인 전환점을 맞이하고 있고, 기술혁신이 몰고 온 우리 사회의 근본적인 변화가"
28,"인문학도, 개발자되다",마르코,영진닷컴,"이제 막 개발에 입문하려는 비전공자를 위해 
문과 출신 개발자가 들려주는 개발 이야기

개발자가 되고 싶은 비전공자를 위해 인문학도 출신인 저자가 어떻게 개발자가 되었는지 그 과정을 이 책 한 권에"
29,가상화의 기본 개념 집에서 배우는 ,Takaoka Susumu,정보문화사,"가상화 기술이 매년 진보함에 따라 가상화가 도입되는 분야는 하루가 다르게 확장되고 있다. 이 책은 이와 같은 흐름에 발맞춰 서버 가상화, 네트워크 가상화, 스토리지 가상화 등 다양한 가상화 기술을 상세하게"
30,클라우드 컴퓨팅 구현 기술 에이콘 클라우드 컴퓨팅 시리즈 2 ,김형준,에이콘출판,"『클라우드 컴퓨팅 구현 기술』은 그 동안 클라우드 컴퓨팅 분야에서 많이 다루지 않았던 시스템이나 서비스의 개발과 관련된 내용을 다룬다. 이 책에서는 분산 아키텍처를 이용해 확장성, 가용성 있는 시스템,"
31,시스템 다이내믹스 모델링과 시뮬레이션,곽상만,북코리아,『시스템 다이내믹스 모델링과 시뮬레이션』은 MIT에서 개발된 예측 기법의 하나인 시스템 다이내믹스를 손쉽게 공부할 수 있는 교재다. 이 교재를 통하여 독자들이 문제의 분석과 동시에 즉시 활용 가능하도록
32,테크니컬 리더,제럴드 M. 와인버그,인사이트,"혁신, 동기부여, 조직화를 통한 문제 해결 리더십 『테크니컬 리더』. 이 책은 아이디어와 혁신을 통해 조직원의 능력을 발휘할 수 있도록 하는 문제 해결형 리더인 테크니컬 리더로 가는 길을 안내한다. 리더십에"
33,프로그래밍 심리학 프로그램 프로그래밍 프로그래머  양장본 HardCover ,제랄드 M. 와인버그,인사이트,"『프로그래밍 심리학』은 프로그래밍을 둘러싼 여러 영역의 사람들이 가지는 마음의 이치를 다루고 있다. '인간 행위로 보는 프로그래밍', '사회 활동으로 보는 프로그래밍', '개인 행위로 보는 프로그래밍'"
34,맨먼스 미신 프로그램 프로그래밍 프로그래머 시리즈 9 ,프레더릭 브룩스,인사이트,『맨먼스 미신』은 저자 프레더릭 브룩스가  IBM 시스템/360 제품군과 그 운영 체제인 OS/360 프로젝트 관리자를 맡으며 겪었던 경험과 그 일에서 비롯된 깨달음을 녹여내 복잡한 프로젝트에 당면해 있는
35,Nature of Code,다니엘 쉬프만,한빛미디어,"『Nature of Code』는 벡터, 진동, 물리 라이브러리, 프랙털, 신경망 등 자연계 법칙을 재밌고 쉽게 구현하면서 프로그래밍을 이해할 수 있도록 구성되어 있다. 이를 위해 비전공자도 비교적 가볍게 접근할 수"
36,스마트 스페이스와 디지털 트랜스포메이션 전략 양장본 HardCover ,이봉규,연세대학교 대학출판문화원,"스마트 스페이스는 최근 전 세계적으로 큰 화두가 되고 있다. 기술의 발전으로 우리가 하루를 보내는 방식이 변화하고, 과거에는 상상 만 했던 서비스들이 실제 공간에 구현되고 있다. 이 책은 우리의 일하는"
37,온톨로지 공학 KORTERM시리즈 17 ,MIZOGUCHI R,두양사,"[머리말]

Ⅰ편은 온톨로지 공학을 개관하여 그 본질과 현상에 대해 간단하게 알고 싶은 분, 온톨로지 공학의 성과를 이용하는 입장에 있는 분들을 위한 입문이며, Ⅱ편은 온톨로지를 스스로 만드는 힘을 기르고"
38,인터넷 윤리 4차 산업혁명 시대의  3판 ,인터넷윤리실천협의회,이한미디어,▶ 이 책은 인터넷 윤리를 다룬 이론서입니다. 인터넷 윤리의 기초적이고 전반적인 내용을 학습할 수 있습니다.
39,플랫폼의 시대 반양장 ,필 사이먼,제이펍,"『플랫폼의 시대』는 오늘날의 비즈니스 세계가 10년 전과 얼마나 달라졌는지에 대해 설명한다. 아마존, 애플, 페이스북, 그리고 구글과 같이 오늘날 가장 성공한 회사들 전혀 다른 비즈니스 모델을 운영하고"
40,미래를 바꿀 IT 과학이야기 IT 과학이야기 # 1 ,이재영,로드북,IT는 그 어떤 것보다 격변하는 세상의 중심에 있다. 이 책 『미래를 바꿀 IT 과학이야기』는 미래를 바꿀 7가지 IT 기술에 관해 과학적 원리를 쉽고 재미있게 풀어낸 책이다. IT 과학자를 꿈꾸는 청소년들에게는
41,알고리즘 마케팅 데이터 과학 ,일리야 캐서브,에이콘출판,"마케팅 분석가를 위한 고급 마케팅 자동화에 관한 가이드다. 테크놀로지, 광고, 소매 업계에서 검증된 다양한 기법을 소개하고 최신 경제학 이론 및 인공지능 기술과 연결시킨다. 이 책에서 소개하는 내용은"
42,소프트 디지털 더 나은 세상을 위한 ,최장현,한빛미디어,이 책은 사람과 사회를 위한 ‘소프트 디지털’을 이야기합니다. 국내외의 사회 이슈와 안전사고 등으로 인해 시민 참여와 공공의 역할 모두에서 디지털의 요구가 높아지고 있습니다. 이 책은 디지털의 다양한
43,4차산업혁명 강의,최재용,미디어북,4차산업혁명 시대 변화를 이해하기 위한 필독서 [4차산업혁명 강의].
