순위,제목,저자,출판사,요약
80,스마트한 생활을 위한 버전2 UCC 제작&편집,IT교재연구팀,시대인,『스마트한 생활을 위한 버전2 UCC 제작&편집』은 UCC에 대한 이해도를 높이고 자신만의 개성을 살린 UCC를 제작할 수 있도록 [기획/준비]-[제작]-[게시] 과정을 모두 담아 처음부터 끝까지 과정을 살펴볼 수
81,스마트한 생활을 위한 버전2 스마트폰을 활용한 UCC 스마트한 생활을 위한 버전2 ,정동임,시대고시기획,"● 따라하기 : 따라하기 방식으로 내용을 구성하여 쉽게 습득할 수 있습니다.
● 배움터 : 따라하면서 부족한 내용이나 알아두어야 할 사항들을 추가적으로 설명하여 실력을 한 단계 더 끌어 올립니다.
●"
82,스마트한 생활을 위한 버전2 동영상 제작&편집,정동임,시대인,"* 따라하기 : 따라하기 방식으로 내용을 구성하여 쉽게 습득할 수 있습니다.
* 배움터 : 따라하면서 부족한 내용이나 알아두어야 할 사항들을 추가적으로 설명하여 실력을 한 단계 더 끌어 올립니다.
* 디딤돌"
83,비디오 코덱과 동영상 포맷 2017  개정판 ,김도훈,커뮤니케이션북스,영상 제작에서 비디오 코덱은 왜 중요한가? 기술적 오류를 줄여 고품질 영상을 제작할 수 있다. 동영상 포맷을 왜 알아야 하나? 영상 제작 초기 단계에서 목적에 맞는 포맷을 선택해 시간과 예산을 절약할 수
84,FAUST를 이용한 사운드 프로그래밍 융합기술 시리즈 2 ,채진욱,씨아이알,"자신만의 악기나 사운드 프로세서를 만들고 싶어 하는 분들을 위한 [FAUST를 이용한 사운드 프로그래밍]. 책은 FAUST와의 첫 만남부터 소리의 음정 조절하기 GUI 설정 , 소리의 음색 바꿔보기 필터 적용하기 ,"
85,사운드 디자인 상상 속의 소리를 현실로  융합기술 시리즈 5 ,채진욱,씨아이알,"‘원서를 읽는 것이 어려운 이유는 영어 때문이 아니라 용어 때문이다.’
그렇습니다. 대부분의 원서 교재들 특히 기술 서적의 경우 이 어렵게 느껴지는 것은 영어보다는 용어 때문입니다. 용어에 대한 정확한"
86,디지털 영상처리 이론과 실습으로 배우는  IT COOKBOOK 221 ,심동규,한빛아카데미,"이론과 실습으로 배우는 디지털 영상처리 핵심 개념 『디지털 영상처리』. 디지털 영상처리의 기초 개념부터 영상 변환 기술, 영상 해석 기술, 동영상 처리 기술의 다양한 기본 이론을 소개합니다. 기본 개념을"
87,Finale 쉽게 따라하기 개정증보판 ,김정민,스코어 score ,"이 책의 장점은 크게 네 가지로 구분할 수 있습니다. 
1. 책을 가볍게 만들었습니다. 그동안 무거운 매뉴얼 북을 가지고 다니느라 어깨가 아프셨죠? 최소한의 무게로 부담을 줄이고, 언제 어디든 간편하게 가지고"
88,러닝! OpenCV 3 위키북스 데이터 사이언스 시리즈 14 ,아드리안 캘러,위키북스,빠르게 팽창하고 있는 컴퓨터 비전 기술 분야를 이 실용서로 시작하라. 오픈 소스 OpenCV 라이브러리 창시자인 아드리안 캘러 Adrian Kaehler 와 개리 브래드스키 Gary Bradski 가 쓴 이 책은 개발자와 재미로
89,포토샵 & 프리미어프로CC 무작정 따라하기 2019 ,민지영,길벗,"포토샵&프리미어 프로 CC 2019의 새로운 버전 출시에 맞춰 새롭게 선보이는 『포토샵&프리미어 프로 CC 2019 무작정 따라하기』는 사용자가 가장 쉽고, 빠르게 포토샵과 프리미어 프로를 배울 수 있도록 기본"
90,된다! 김메주의 유튜브 영상 만들기 전면개정판 ,김혜주,이지스퍼블리싱,"★ 유튜브 분야 베스트셀러 〈된다! 김메주의 유튜브 영상 만들기〉 전면 개정판 출시! 
★ 유튜브 시작 1년 만에 구독자 10만 명!★ 예능 자막부터 비밀스런 광고 수익까지, 가장 빨리 유튜버가 되는 9가지"
91,신중년이 쉽게 배우고 따라하는 스마트폰 활용,허수연,에스엔에스소통연구소,"이번에 출간하는 책은 10여년동안 스마트폰 활용 교육을 해오고 있는 SNS소통연구소에서 시니어 실버분들의 즐거운 인생을 위해 시니어 실버가 보기 편하게 제작한 책입니다.

책 크기도 A4 크기이고 글자"
92,스마트폰 교육 전문가와 함께하는 즐거운 스마트폰 활용,문정임,에스엔에스소통연구소,"이번에 출간하는 책은 10여년동안 스마트폰 활용 교육을 해오고 있는 SNS소통연구소에서 시니어 실버분들의 즐거운 인생을 위해 시니어 실버가 보기 편하게 제작한 책입니다.

책 크기도 A4 크기이고 글자"
93,스마트한 신중년을 위한 스마트폰 활용 교육,김인숙,에스엔에스소통연구소, 
94,동영상 편집: 파워디렉터 쉽게 배우고 생활에 바로 쓰는  능력향상 시리즈 시즌 2 ,오상열,아이콕스,"쉽게 배우고 생활에 바로 쓰는 능력향상 시리즈  시즌 2 

능력향상 시리즈는 컴퓨터를 잘 다루지 못하는 일반인, 컴퓨터를 처음 접하는 어르신들을 위해 만들어졌습니다. 실생활에 바로 적용할 수 있는"
95,스마트폰 소통 전문가 김인숙과 함께하는 행복한 스마트폰 활용 교육,김인숙,에스엔에스소통연구소,"스마트폰 제대로 배우고 익히면 인생이 즐거워지고 비즈니스가 풍요로워집니다.

시니어 실버들이 꼭 알아야 할 스마트폰 활용 노하우에 대해서 담고 있는 책입니다.

가족간 세대간의 소통을 위해서라도 스마트폰"
96,스마트폰 활용 길라잡이 퇴직 예정자들이 꼭 알아야 할 ,이성원,에스엔에스소통연구소,▶ 스마트폰 활용에 관한 내용을 담은 전문서적입니다.
97,즐거운 스마트폰 활용 스마트폰 강사 김용희와 함께하는 ,김용희,SNS소통연구소,▶ 스마트폰 활용에 관한 내용을 담은 전문서적입니다.
98,안드로이드 9.0 앱 프로그래밍 Pie 버전  실무에 바로 적용 할 수 있는  2판 ,박헌우,다본,"이 책은 안드로이드에 처음 접하는 사람들이 쉽게 앱을 만들 수 있도록 도와준다.

안드로이드 개발을 위한 필수적이고 기초적인 내용뿐만 아니라 안드로이드 개발자라면 꼭 알아야 할 심도 있는 내용까지 쉽게"
99,송택동의 컴퓨터음악 따라하기 개정판 ,송택동,사랑이있는풍경,"이 책은 '고운꿈', '우주자전거'의  작곡가 송택동이 시벨리우스7과 뮤즈스코어2를 활용한 컴퓨터음악을 안내한다."
100,EndNote 엔드노트  X7 Easy Power,이필수,오피스허브,"[EndNote X7 Easy Power]는 참고문헌 Reference 의 이해, 참고문헌 Reference  관리 프로그램, 엔드노트 EndNote 의 개요, Libray 생성 및 Reference 수집, Reference 관리, Group 관리, Output Style과 Term"
101,CUBASE 큐베이스 널 사용하고 싶다,홍성선,힐북,"큐베이스는 음악을 만들기 위한 작곡, 편곡, 믹싱, 마스터링의 작업 가능한 DAW로써 큐베이스를 처음 접하는 입문자와 초보자, 작편곡가, 싱어송라이터, 음악대학교 전공자, 수업 및 레슨의 지도자와 학습자 등"
102,파워디렉터로 UCC 동영상 편집 고수되기 Think Tools ,비비드북 교재개발실,비비드북,"[파워디렉터로 UCC 동영상 편집 고수되기]는 쉽고 빠르게 UCC작품이나 성장앨범, 업무용 동영상을 편집할 수 있도록 안내한 도서이다. 파워디렉터의 강력한 기능으로 내가 촬영한 비디오를 특별하게 꾸밀 수"
103,파워디렉터 15 동영상 편집 사용자를 위한 ,기분전환,비비드북,"[영상 편집 사용자를 위한 파워디렉터 15]는 영상 편집의 기초부터 고급 활용까지 해결할 수 있도록 도와주는 책이다. 책은 완벽한 사용자 지정으로 디테일한 영상 편집 및 스마트폰 세로 영상 지원, 마스크"
104,나의꿈 나의미디 Cakewalk by Bandlab,박운영,예진미디어,"1995년 이후, 컴퓨터음악 부문 국내 첫 베스트셀러였고, 미디음악의 붐을 이끌었던 책,  '나의꿈 나의미디' 시리즈의 최신작입니다. 이 책은 21세기 가장 완벽한 시퀀서 중 하나인 케이크워크 밴드랩 Cakewalk by"
105,쉽게 하자 영상 편집,유민지,우리사이플래닛,"“요즘 단축키 외우고 있는데 너무 어려워.
바보 같은 질문인데, 너는 어떻게 다 외웠어?”

며칠 전, 영상 편집을 공부하고 있다는 친구가 제게 물었습니다.
아, 당황스러웠습니다. 끽해야 ‘Ctrl+C’,"
106,SERUM 가이드북,Written by THE LEGEND,사운드캣,Serum은 웨이브 테이블 방식의 Synthesizer로 많은 유저들에게 호평을 받고 있는 VST 방식의 인스트루먼트입니다. 한국에서도 정식 유통사가 지정되고 이에 많은 유저분들이 보다 쉽게 Serum을 사용할 수 있도록
