순위,제목,저자,출판사,요약
1,Do it! 안드로이드 앱 프로그래밍 전면개정판 6판 ,정재곤,이지스퍼블리싱,"8년 연속 안드로이드 분야 1위!
Do it! 안드로이드 앱 프로그래밍이 새 옷을 갈아입고 돌아왔다!
《Do it! 안드로이드 앱 프로그래밍》의 6번째 전면 개정판이 나왔습니다. 이번 개정판은 그동안 발전한"
2,깡샘의 안드로이드 프로그래밍,강성윤,루비페이퍼,"이 책은 각 챕터마다 안드로이드 프로그램과 각 기능이 어떠한 구조로 어떻게 작동하는지 그 원리를 파악하는 데 주력합니다. 그리고 이를 구현하는 핵심 코드를 알아본 다음, 이를 종합하여 실제 상용 앱에서"
3,돈 되는 안드로이드 앱 만들기,조상철,영진닷컴,"이 책은 안드로이드 앱 개발에 필요한 자바 문법과 안드로이드 스튜디오 설치 과정을 설명하고, 안드로이드 앱을 직접 만들고 play스토어에 앱 등록하기까지 한 권으로 설명합니다.  Layout, View, Fragment 등 앱"
4,스무디 한 잔 마시며 끝내는 React Native,김정헌,비제이퍼블릭,"최근 서비스를 개발하기 위해서는 웹뿐만 아니라 iOS, 안드로이드 앱을 제공해야 한다. 이 모든 것을 하나의 언어로 개발할 수 있으면 얼마나 좋을까? 이 질문에 대한 최고의 대답이 이 책에 담겨 있다. 이 책을"
5,하루 만에 배우는 안드로이드 앱 만들기 2판 ,서창준,영진닷컴,"어려운 프로그래밍에 대해 모르는 왕초보여도 안드로이드 앱을 만들 수 있을까요? 물론! 프로그래머가 아니어도, 어려운 프로그래밍 코드를 몰라도 누구나 쉽게 앱을 만들 수 있습니다. 이 책은 안드로이드"
6,오준석의 안드로이드 생존코딩: 코틀린 편 소문난 명강의 ,오준석,한빛미디어,"이 책은 기본을 빠르게 익히고 나서 현업에서 사용하는 라이브러리와 프레임워크로 앱을 효과적으로 만드는 방법을 알려주는 입문 + 활용서입니다. 코틀린을 몰라도, 안드로이드를 몰라도 안드로이드 앱을 만들 수"
7,Kotlin in Action 모바일 프로그래밍  Paperback ,드미트리 제메로프,에이콘출판,코틀린이 안드로이드 공식 언어가 되면서 관심이 커졌다. 이 책은 코틀린 언어를 개발한 젯브레인의 코틀린 컴파일러 개발자들이 직접 쓴 일종의 공식 서적이라 할 수 있다. 코틀린 언어의 가장 큰 특징이라면
8,안드로이드 스튜디오를 활용한 실전 앱 만들기 자바 기초부터 앱 출시까지 ,조상철,영진닷컴,자바 기초부터 앱 출시까지 한 권으로 배우는 ‘안드로이드 스튜디오를 활용한 실전 앱 만들기’ 『안드로이드 스튜디오를 활용한 실전 앱 만들기』는 최신 Android 8.0 버전과 Android Studio 3.0 최신 버전을
9,Do it! 스위프트로 아이폰 앱 만들기 입문  개정판 3판 ,송호정,이지스퍼블리싱,▶ 이 책은 모바일프로그래밍을 다룬 이론서입니다. 모바일프로그래밍의 기초적이고 전반적인 내용을 학습할 수 있습니다.
10,안드로이드 with Kotlin 앱 프로그래밍 가이드 애프터스킬 시리즈 ,안귀정,아이콕스,"자바와 코틀린으로 직접 구현하며 익히는 실전형 앱 프로그래밍 완벽 가이드!
안드로이드 9.0 파이 Pie , Java+Kotlin, 안드로이드 스튜디오 3.2, 실전형 앱 프로젝트
로또번호생성기, 퀴즈잠금화면앱,"
11,구글 클라우드 플랫폼 인 액션 실습으로 완성하는  제이펍의 클라우드 시리즈 19 ,제이 제이 지웍스,제이펍,"전 세계의 수많은 개발자가 구글 클라우드 플랫폼을 신뢰한다. 이 구글 클라우드 플랫폼을 통해 검색을 할 수 있고, 지도 기능을 사용할 수 있으며, 일반적으로 사용하는 도구로 인프라에서 애플리케이션을"
12,앱인벤터+아두이노 스마트폰 앱 프로젝트 블루투스 와이파이 통신을 이용한 ,우지윤,디지털북스,"앱인벤터로 스마트폰 앱을 직접 만들고 아두이노와 연동하는 11가지 프로젝트 수록
생활 속 스마트 제품을 아두이노와 앱인벤터를 통해 직접 만들고 싶은 분께 추천!

2018년을 맞아 드디어 우리나라에서도"
13,리액트 네이티브 인 액션,네이더 다빗,프리렉,리액트 네이티브는 모바일과 웹 개발자들에게 이 프레임워크가 가진 이점으로 효율성과 생산성을 빠르게 높일 수 있는 힘을 부여합니다. 우리가 만든 앱을 iOS와 Android 그리고 웹에 쉽게 배포합니다. 리액트
14,파이어베이스 안드로이드 기반  백견불여일타 ,남진하,로드북,"이 책은 파이어베이스의 거의 모든 서비스를 실습 과정을 통해 빠르게 배울 수 있도록 하는 데 목표를 두었다. 자체 서버 시스템 구축 없이 쉽게 인증 작업을 할 수 있고 사용자 모니터링, 콘텐츠 저장과 호스팅"
15,프로페셔널 안드로이드 4판  제이펍의 모바일 시리즈 37 ,리토 마이어,제이펍,"초판 출간 후 10년 동안 업데이트를 거쳐 안드로이드 개발자의 바이블로 자리 잡은 바로 그 책!
플랫폼의 다양한 기능을 바탕으로 안드로이드 개발의 모든 것을 집대성한 결정판!

초판 출간 후 10년! 완전히"
16,구글 클라우드 플랫폼 입문,아사 시호,프리렉,구글 클라우드 플랫폼의 기능과 시스템 구축 패턴! 이 책은 구글 클라우드 플랫폼 GCP 으로 시스템이나 애플리케이션을 구축하는 데 도움을 주는 실천적인 입문서입니다. GCP를 처음 이용하는 개발자를 주
17,커니의 코틀린: 차세대 안드로이드 개발자를 위한,김태호,인사이트,안드로이드 애플리케이션을 자바로 만들어야 하는 이상 어쩔 수 없이 감내해야 했던 많은 문제의 해결책이 이제 눈앞에 보입니다. 바로 코틀린을 활용하는 것입니다. 코틀린은 자바와 100% 호환이 가능하기 때문에
18,앱 인벤터 swedu 7 ,이종원,한빛아카데미,"컴퓨팅 사고력을 키우는 소프트웨어 교육, 앱 인벤터로 시작하세요.

지금까지 프로그래밍을 접해보지 않았더라도 앱 인벤터로 블록을 조립하면서 나만의 안드로이드 앱을 만들다 보면 프로그래밍의 기본"
19,앱 인벤터로 나만의 앱 만들기 생자소 시리즈 ,CODABLE 코더블 ,해람북스 구 북스홀릭 ,『앱 인벤터로 나만의 앱 만들기』는 구글과 MIT 미디어 랩에서 누구나 쉽게 자신이 원하는 안드로이드 스마트 폰 앱을 직접 만들어 사용할 수 있도록 만든 앱 인벤터를 통해 초보자도 쉽게 이해하고 앱을 구현할
20,꼼꼼한 재은 씨의 스위프트: 기본편 꼼꼼한 재은 씨의 스위프트 시리즈 2 ,이재은,루비페이퍼,"이 책은 꼼꼼한 재은 씨의 스위프트 시리즈 중 두 번째 순서로, 최근 발표된 스위프트 4.0을 기준으로 iOS 앱 제작 과정을 학습합니다. 코코아 터치 프레임워크를 다루는 방법을 익히고, 스토리보드를 이용하여"
21,코딩스쿨 앱인벤터 앱 프로그래밍 기초,렉스기획팀,렉스미디어,앱 인벤터란? 구글과 MIT 미디어 랩에서 복잡한 프로그래밍 언어 대신 퍼즐처럼 조립할 수 있는 블록을 이용해 초보자도 쉽게 안드로이드 앱을 만들 수 있게 도와주는 웹 기반의 앱 개발 도구이다. 일상생활에서
22,드론 나혼자 코딩,문근민,디지털북스,"코드론2 출시정보를 담았습니다! 저자가 얼리어답터로 드론을 접하면서 얻은 노하우를 통해 드론이나 코딩을 전혀 알지 못하는 초보자도 쉽게 따라할 수 있는 예제와 드론 조종법, 공역 정보 등 드론을 날릴 때"
23,안드로이드 임베디드 시스템 가이드북 비글보드로 배우는 ,박규호,영진닷컴,"카이스트 전기전지공학과 교수 박규호, 대전대학교 해킹보안학과 교수 박기웅의 『비글보드로 배우는 안드로이드 임베디드 시스템 가이드북』. 비글보드와 함께 안드로이드와 리눅스를 함께 다룬다. 실무에서 꼭"
24,Amazon Web Services로 시작하는 클라우드 입문,WINGS 프로젝트 아사 시호,영진닷컴,이 책은 Amazon Web Services AWS 를 처음으로 사용하는 사람을 위해 업무 시스템에서 널리 활용되는 Java 기반의 Web 시스템을 구축하는 절차를 GUI를 사용하여 설명한 입문서이다. 인프라 구축 경험이 적은 젊은
25,앱 인벤터로 도전! 안드로이드 앱 디벨로퍼,CODABLE 코더블 ,성안당,앱 인벤터는 스마트폰용 앱 프로그래밍 언어의 첫 단계로 최근 주목을 한 눈에 받고 있다. 코더블 Codable 이라는 IT교육 기업이 개발한 이 책은 앱 인벤터로 개발한 앱을 실제로 단계별로 따라 해 보면서 활용할
26,안드로이드 API 바이블 PROGRAMMERS MOBILE RECIPE 시리즈 3 ,유동근,정보문화사,모바일 전 분야의 실전 지식을 간결하고 이해하기 쉽게 전달하는 「안드로이드 API 바이블」시리즈 『안드로이드 API 바이블』. 이 책은 안드로이드가 제공하는 200여개의 핵심 예제를 통해 개발자들이 좀 더 쉽고
27,모바일 인터랙션 디자인,카메론 방가,정보문화사,『모바일 인터랙션 디자인』은 100개 이상의 모바일 앱을 개발해온 저자가 자신이 직접 얻은 원칙과 기술을 아낌없이 공유한다. 저자의 경험과 각종 예시를 통해 모바일 앱을 사용하는 누구든 모바일의 역사부터
28,SNS와 유튜브 1인 미디어를 위한 스마트폰 활용법,김경수,정보문화사,"스마트폰의 창의적인 활용법?

이 책은 두 가지 관점에서 스마트폰의 창의적인 활용법을 안내합니다.

첫째, SNS나 유튜브의 1인 미디어, 즉 SNS 초보 유저, 유튜버, 파워블로거 또는 디자이너, 홍보"
29,노드로 하는 웹 앱 테스트 자동화 헤드리스 브라우저와 모카를 활용한  acorn+PACKT ,페드로 테세이라,에이콘출판,『노드로 하는 웹 앱 테스트 자동화』는 노드 텃 비디오 튜토리얼 Node Tuts video tutorial 로 이미 잘 알려진 페드로 테세이라가 집필한 책이다. 범용 웹 테스트 프레임워크를 지원하는 헤드리스 브라우저인
30,모바일 포렌식 에이콘 모바일 프로그래밍 시리즈 ,사티시 봄미세티,에이콘출판,"이 책 [모바일 포렌식]은 iOS, 안드로이드, 윈도우, 블랙베리 플랫폼에서의 모바일 포렌식 기법에 대해 설명한다. 모바일 포렌식의 핵심적 요소와 기기에서 데이터를 추출하고 삭제된 데이터를 복구하고, 화면"
31,고품질 앱을 위한 모바일 테스팅 에이콘 소프트웨어 테스팅 시리즈 ,다니엘 노트,에이콘출판,[고품질 앱을 위한 모바일 테스팅]은 저자의 실제 경험을 바탕으로 모바일 테스트 계획부터 수행까지 전체 프로세스를 폭넓게 다룬다. 이 책의 핵심은 모바일에 특화된 테스트 방법과 자동화 도구의 설명 및 선택
32,OAuth 2.0 마스터 acorn+PACKT 시리즈 ,찰스 비히스,에이콘출판,"OAuth 2.0은 현재 가장 널리 사용되는 표준 인가 프로토콜로, 세계적으로 유명한 서비스 제공자와 상호작용해 세계적인 수준의 기술을 활용할 수 있게 해주는 강력한 인가 프레임워크다. OAuth 2.0이 무엇이고,"
33,안드로이드 애플리케이션 리버스 엔지니어링 에이콘 해킹 보안 시리즈 ,남대현,에이콘출판,"[안드로이드 애플리케이션 리버스 엔지니어링]은 안드로이드 애플리케이션 설치 방법부터 동적 디버깅에 이르는 다양한 분석 방법을 담은 책이며, 난독화 및 분석 방지 솔루션 등 분석이 막혔을 때, 돌파구를 찾을"
34,Cocos2d x 멀티 플랫폼 게임 프로그래밍 만들면서 배우는 ,노재현,한빛미디어,『Cocos2d x 멀티 플랫폼 게임 프로그래밍』은 C++와 Cocos2d-x를 이용해 퍼즐 게임과 슈팅 게임을 만들어보면서 모바일 멀티 플랫폼 게임 프로그래밍을 익힐 수 있는 교재이다. 애니팡과 같은 퍼즐 게임과 드래곤
35,그레이들 레시피,켄 커즌,한빛미디어,"『그레이들 레시피』는 그레이들로 안드로이드 애플리케이션 빌드 작업을 할 수 있도록 다양한 레시피 Recipe 를 소개하고, 안드로이드 프로젝트에서 흔히 발생하는 여러 빌드 문제를 해결할 수 있는 유용한 팁을"
36,앱 인벤터 코딩 & 플레이 2 ,코더블 CODABLE ,혜지원,앱인벤터로 간단한 게임부터 센서 프로그래밍까지 구현하는 『누구나 쉽게 만드는 스마트폰 앱 앱인벤터』. 이 책은 스마트폰 안의 센서를 이용하여 누구나 쉽게 앱을 만들고 활용할 수 있는 초간단 앱 만들기
37,안드로이드 레시피 위키북스 임베디드 모바일 시리즈 22 ,데이브 스미스,위키북스,빠르게 활용하는 안드로이드 문제 해법서『안드로이드 레시피』. 안드로이드 세계에서 발생할 수 있는 문제점들을 하나씩 살펴보고 다양한 해결책을 최소 API 레벨에서 제공한다. 이 책은 안드로이드 개발자가
38,안드로이드 프로그래밍 Android Studio를 활용한  개정판 3판  IT CookBook 230 ,우재남,한빛아카데미,"Android 8.0  오레오  버전으로 만나는 Android Studio를 활용한 안드로이드 프로그래밍
1.초보자도 쉽게 접근할 수 있도록 친절하게 설명한다.
2.프로그램을 단계별로 완성해가면서 코드에 대한 이해도를"
39,AWS 기반 서버리스 아키텍처 위키북스 오픈소스 & 웹 시리즈 88 ,피터 스바르스키,위키북스,AWS Lambda 예제로 살펴보는 AWS 기반 서비리스 아키텍처는 가장 까다로운 웹 및 모바일 애플리케이션을 구동할 수 있는 서버리스 아키텍처를 구축하고 보안성을 확보하며 관리하는 방법을 가르쳐 준다. 이
40,안드로이드 스튜디오 3 통달 모바일 프로그래밍 ,카일 뮤,에이콘출판,"안드로이드 스튜디오가 안드로이드 앱 개발에 독보적인 IDE로 자리 잡은 지 몇 년이 지났다. 이제 안드로이드 스튜디오는 안드로이드 앱을 개발하는 단순한 IDE가 아니라 버그 수정, 성능 개선, UI 최적화,"
41,Boost C++ 애플리케이션 개발 2판 ,안토니 폴루킨,에이콘출판,"현대 C++에 맞춰 부스트 라이브러리를 소개한다. 부스트 라이브러리는 C++ STL로 포함되기 전에 실험적인 라이브러리를 철저히 검증해 정식으로 선보인다. 부스트에서 C++11, C++14뿐 아니라 C++17에 포함된"
42,나의 첫 안드로이드 처음 시작하는 개발자를 위한 ,한동호,한빛미디어,"안드로이드 개발 환경은 빠르게 변화하고 있고, 이를 대응하기 위해서는 탄탄한 기본기가 필요합니다. 이 책은 안드로이드를 처음 접하는 독자들을 위해 기본 개념부터 설명하고, 쉽게 따라하면서 안드로이드 앱을"
43,바이플러그로 코딩없이 앱 개발하기,최영석,지식과감성,"바이플러그로 앱 개발 방법을 알려준다. 바이플러그를 알면 코딩을 몰라도 앱을 개발할 수 있다. 바이플러그 앱 메이커에서 활용할 수 있는 데이터블록, UI블록, 액션기능, 메뉴설정, 제목속성, 탭구조, 필터"
44,스위프트로 아이폰 앱 만들기: 입문 Do it!  개정판 4판 ,이범근,이지스퍼블리싱,"아이폰 분야 1위 도서, 개정 4판 출간!
최신 버전인 스위프트 5, Xcode 11 반영!
아이폰 분야 1위 도서, 《Do it! 스위프트로 아이폰 앱 만들기 입문》 개정 4판이 출간되었다. 이번 개정에서는 Swift 5, Xcode"
45,안드로이드 서비스 개발 Node.js와 오픈소스를 활용한  제이펍의 모바일 시리즈 33 ,한동호,제이펍,이 책은 맛집 검색 및 등록 서비스를 제공하는 ‘베스트푸드’ 애플리케이션 개발 과정을 설명한다. 이를 통해 클라이언트와 서버 그리고 데이터베이스를 어떻게 구성하는지를 배울 수 있다. 클라이언트는
46,Firebase로 안드로이드 SNS 앱 만들기 Udemy.com 베스트셀러 강사 하울의 ,하울,비제이퍼블릭,예전에는 안드로이드 환경에서 앱만 만들어서는 안되고 서버도 같이 만들어야 했습니다. 서버를 만들지 못하면 앱에 뿌려줄 정보가 존재하지 않게 되기 때문입니다. 서버를 구현하지 못한다면 아무리 코딩 능력이
47,꼼꼼한 재은 씨의 스위프트 Swift  2 프로그래밍,이재은,루비페이퍼,"이 책은 스위프트 2.0의 기본 문법과 구문을 설명하고 있으며, 객체 지향 언어의 특징과 타입 추론, 클로저, 추상화 등 모던 프로그래밍 언어의 핵심, 그리고 일급 함수로 대표되는 함수형 프로그래밍의"
48,될 때까지 안드로이드,오준석,루비페이퍼,None
49,안드로이드 미디어 프로그래밍 빛과 소리의 향연 ,박헌재,투에이치앤에스,"[안드로이드 미디어 프로그래밍]은 고등학교 2학년이상의 수학 능력과 기본적인 안드로이드 프로그래밍의 지식을 갖춘 독자들 중 카메라와 멀티미디어 프로그램을 배우고자 하는 이들을 위해 물리학과 수학,"
50,안드로이드 통신 프로그래밍 기적을 부르는  3판 ,박헌재,투에이치앤에스,"[특징]
이 책의 주요 특징은 다음과 같습니다.
1. 통신 프로토콜이 가지는 독특한 특성을 다룹니다.
독자 여러분들이 특정 자바 클래스를 모른다하더라도 소켓 프로그램과 같은 기반 기술과 통신 프로토콜을"
